{
  "schema_version": "0.1.0",
  "as_of_date": "2026-09-06",
  "record_count": 249,
  "records": [
    {
      "name": "Andorra",
      "official_name": "Principality of Andorra",
      "iso2": "AD",
      "iso3": "AND",
      "numeric_code": "020",
      "region_id": "europe",
      "subregion_id": "southern-europe",
      "intermediate_region_id": null,
      "currency_codes": [
        "EUR"
      ],
      "trade_group_ids": [],
      "customs_relationship_ids": [],
      "wto_member": false,
      "customs_authority_id": null,
      "trade_portal_ids": [],
      "trade_agency_ids": [],
      "standards_body_id": null,
      "landlocked": null,
      "aliases": [],
      "source_ids": [
        "debian-iso-codes",
        "un-m49",
        "unicode-cldr"
      ]
    },
    {
      "name": "United Arab Emirates",
      "official_name": null,
      "iso2": "AE",
      "iso3": "ARE",
      "numeric_code": "784",
      "region_id": "asia",
      "subregion_id": "western-asia",
      "intermediate_region_id": null,
      "currency_codes": [
        "AED"
      ],
      "trade_group_ids": [
        "gulf-cooperation-council",
        "world-trade-organization"
      ],
      "customs_relationship_ids": [
        "gcc-customs-union"
      ],
      "wto_member": true,
      "customs_authority_id": null,
      "trade_portal_ids": [],
      "trade_agency_ids": [],
      "standards_body_id": null,
      "landlocked": null,
      "aliases": [],
      "source_ids": [
        "debian-iso-codes",
        "gcc-customs-union",
        "gcc-members",
        "un-m49",
        "unicode-cldr",
        "wto-members"
      ]
    },
    {
      "name": "Afghanistan",
      "official_name": "Islamic Republic of Afghanistan",
      "iso2": "AF",
      "iso3": "AFG",
      "numeric_code": "004",
      "region_id": "asia",
      "subregion_id": "southern-asia",
      "intermediate_region_id": null,
      "currency_codes": [
        "AFN"
      ],
      "trade_group_ids": [
        "world-trade-organization"
      ],
      "customs_relationship_ids": [],
      "wto_member": true,
      "customs_authority_id": null,
      "trade_portal_ids": [],
      "trade_agency_ids": [],
      "standards_body_id": null,
      "landlocked": true,
      "aliases": [],
      "source_ids": [
        "debian-iso-codes",
        "un-m49",
        "unicode-cldr",
        "wto-members"
      ]
    },
    {
      "name": "Antigua and Barbuda",
      "official_name": null,
      "iso2": "AG",
      "iso3": "ATG",
      "numeric_code": "028",
      "region_id": "americas",
      "subregion_id": "latin-america-and-the-caribbean",
      "intermediate_region_id": "caribbean",
      "currency_codes": [
        "XCD"
      ],
      "trade_group_ids": [
        "world-trade-organization"
      ],
      "customs_relationship_ids": [],
      "wto_member": true,
      "customs_authority_id": null,
      "trade_portal_ids": [],
      "trade_agency_ids": [],
      "standards_body_id": null,
      "landlocked": null,
      "aliases": [],
      "source_ids": [
        "debian-iso-codes",
        "un-m49",
        "unicode-cldr",
        "wto-members"
      ]
    },
    {
      "name": "Anguilla",
      "official_name": null,
      "iso2": "AI",
      "iso3": "AIA",
      "numeric_code": "660",
      "region_id": "americas",
      "subregion_id": "latin-america-and-the-caribbean",
      "intermediate_region_id": "caribbean",
      "currency_codes": [
        "XCD"
      ],
      "trade_group_ids": [],
      "customs_relationship_ids": [],
      "wto_member": false,
      "customs_authority_id": null,
      "trade_portal_ids": [],
      "trade_agency_ids": [],
      "standards_body_id": null,
      "landlocked": null,
      "aliases": [],
      "source_ids": [
        "debian-iso-codes",
        "un-m49",
        "unicode-cldr"
      ]
    },
    {
      "name": "Albania",
      "official_name": "Republic of Albania",
      "iso2": "AL",
      "iso3": "ALB",
      "numeric_code": "008",
      "region_id": "europe",
      "subregion_id": "southern-europe",
      "intermediate_region_id": null,
      "currency_codes": [
        "ALL"
      ],
      "trade_group_ids": [
        "world-trade-organization"
      ],
      "customs_relationship_ids": [],
      "wto_member": true,
      "customs_authority_id": null,
      "trade_portal_ids": [],
      "trade_agency_ids": [],
      "standards_body_id": null,
      "landlocked": null,
      "aliases": [],
      "source_ids": [
        "debian-iso-codes",
        "un-m49",
        "unicode-cldr",
        "wto-members"
      ]
    },
    {
      "name": "Armenia",
      "official_name": "Republic of Armenia",
      "iso2": "AM",
      "iso3": "ARM",
      "numeric_code": "051",
      "region_id": "asia",
      "subregion_id": "western-asia",
      "intermediate_region_id": null,
      "currency_codes": [
        "AMD"
      ],
      "trade_group_ids": [
        "world-trade-organization"
      ],
      "customs_relationship_ids": [],
      "wto_member": true,
      "customs_authority_id": null,
      "trade_portal_ids": [],
      "trade_agency_ids": [],
      "standards_body_id": null,
      "landlocked": true,
      "aliases": [],
      "source_ids": [
        "debian-iso-codes",
        "un-m49",
        "unicode-cldr",
        "wto-members"
      ]
    },
    {
      "name": "Angola",
      "official_name": "Republic of Angola",
      "iso2": "AO",
      "iso3": "AGO",
      "numeric_code": "024",
      "region_id": "africa",
      "subregion_id": "sub-saharan-africa",
      "intermediate_region_id": "middle-africa",
      "currency_codes": [
        "AOA"
      ],
      "trade_group_ids": [
        "african-continental-free-trade-area",
        "african-union",
        "world-trade-organization"
      ],
      "customs_relationship_ids": [],
      "wto_member": true,
      "customs_authority_id": null,
      "trade_portal_ids": [],
      "trade_agency_ids": [],
      "standards_body_id": null,
      "landlocked": null,
      "aliases": [],
      "source_ids": [
        "afcfta-status",
        "african-union-members",
        "debian-iso-codes",
        "un-m49",
        "unicode-cldr",
        "wto-members"
      ]
    },
    {
      "name": "Antarctica",
      "official_name": null,
      "iso2": "AQ",
      "iso3": "ATA",
      "numeric_code": "010",
      "region_id": null,
      "subregion_id": null,
      "intermediate_region_id": null,
      "currency_codes": [],
      "trade_group_ids": [],
      "customs_relationship_ids": [],
      "wto_member": false,
      "customs_authority_id": null,
      "trade_portal_ids": [],
      "trade_agency_ids": [],
      "standards_body_id": null,
      "landlocked": null,
      "aliases": [],
      "source_ids": [
        "debian-iso-codes",
        "un-m49",
        "unicode-cldr"
      ]
    },
    {
      "name": "Argentina",
      "official_name": "Argentine Republic",
      "iso2": "AR",
      "iso3": "ARG",
      "numeric_code": "032",
      "region_id": "americas",
      "subregion_id": "latin-america-and-the-caribbean",
      "intermediate_region_id": "south-america",
      "currency_codes": [
        "ARS"
      ],
      "trade_group_ids": [
        "group-of-twenty",
        "mercosur",
        "world-trade-organization"
      ],
      "customs_relationship_ids": [
        "mercosur-customs-union"
      ],
      "wto_member": true,
      "customs_authority_id": null,
      "trade_portal_ids": [],
      "trade_agency_ids": [],
      "standards_body_id": null,
      "landlocked": null,
      "aliases": [],
      "source_ids": [
        "debian-iso-codes",
        "g20-members",
        "mercosur-members",
        "un-m49",
        "unicode-cldr",
        "wto-members"
      ]
    },
    {
      "name": "American Samoa",
      "official_name": null,
      "iso2": "AS",
      "iso3": "ASM",
      "numeric_code": "016",
      "region_id": "oceania",
      "subregion_id": "polynesia",
      "intermediate_region_id": null,
      "currency_codes": [
        "USD"
      ],
      "trade_group_ids": [],
      "customs_relationship_ids": [],
      "wto_member": false,
      "customs_authority_id": null,
      "trade_portal_ids": [],
      "trade_agency_ids": [],
      "standards_body_id": null,
      "landlocked": null,
      "aliases": [],
      "source_ids": [
        "debian-iso-codes",
        "un-m49",
        "unicode-cldr"
      ]
    },
    {
      "name": "Austria",
      "official_name": "Republic of Austria",
      "iso2": "AT",
      "iso3": "AUT",
      "numeric_code": "040",
      "region_id": "europe",
      "subregion_id": "western-europe",
      "intermediate_region_id": null,
      "currency_codes": [
        "EUR"
      ],
      "trade_group_ids": [
        "european-union",
        "world-trade-organization"
      ],
      "customs_relationship_ids": [
        "eu-customs-union",
        "eu-turkiye-customs-union"
      ],
      "wto_member": true,
      "customs_authority_id": null,
      "trade_portal_ids": [],
      "trade_agency_ids": [],
      "standards_body_id": null,
      "landlocked": null,
      "aliases": [],
      "source_ids": [
        "debian-iso-codes",
        "eu-customs-union",
        "eu-members",
        "eu-turkiye-trade",
        "un-m49",
        "unicode-cldr",
        "wto-members"
      ]
    },
    {
      "name": "Australia",
      "official_name": null,
      "iso2": "AU",
      "iso3": "AUS",
      "numeric_code": "036",
      "region_id": "oceania",
      "subregion_id": "australia-and-new-zealand",
      "intermediate_region_id": null,
      "currency_codes": [
        "AUD"
      ],
      "trade_group_ids": [
        "group-of-twenty",
        "world-trade-organization"
      ],
      "customs_relationship_ids": [],
      "wto_member": true,
      "customs_authority_id": null,
      "trade_portal_ids": [],
      "trade_agency_ids": [],
      "standards_body_id": null,
      "landlocked": null,
      "aliases": [],